{
  "protocol": "1",
  "request_id": "webui-1710000000-1234",
  "source": "webui",
  "command": "frontend.event",
  "payload": {
    "action": "operator-click",
    "button": "start"
  },
  "meta": {
    "timestamp_utc": "2026-05-30T07:45:00Z",
    "correlation_id": "case-001",
    "content_type": "application/json",
    "schema": "daemon-message"
  }
}
